{
  "schema_version": "1",
  "symbol": "EXAMPLE",
  "timestamp": "2025-01-02T15:00:01Z",
  "as_of_timestamp": "2025-01-02T15:00:00Z",
  "horizon": "5d",
  "thesis": {
    "text": "Insufficient evidence for a directional assessment.",
    "evidence_ids": [
      "news-1"
    ]
  },
  "bull_case": [],
  "bear_case": [],
  "catalysts": [],
  "risks": [
    {
      "text": "No price or fundamental data supplied.",
      "evidence_ids": []
    }
  ],
  "fundamentals": null,
  "technicals": null,
  "sentiment": null,
  "market_context": null,
  "confidence": "low",
  "missing_data": [
    "prices",
    "fundamentals"
  ],
  "suggested_signal_state": "insufficient_evidence"
}
